{
  "org": "meridian-labs",
  "generatedAt": "2026-09-14T13:38:01.057Z",
  "scanRoot": "demo-org",
  "azure": null,
  "validation": {
    "newlyDiscovered": [],
    "unclonedOrgRepos": [],
    "staleClones": [],
    "duplicateClones": [],
    "repoRenames": [],
    "repoMissingOnGitHub": [],
    "uncuratedRepos": [],
    "incompleteCuration": [],
    "statusMismatch": []
  },
  "inventory": [
    {
      "name": "Design System",
      "abbr": "DS",
      "type": "Library",
      "subtype": "UI",
      "status": "Current",
      "owner": "Platform",
      "cluster": "Shared",
      "applications": [
        "Shop",
        "Ops Console",
        "Partner API"
      ],
      "description": "Shared React component library and design tokens",
      "contact": "Priya Raman",
      "introDate": "",
      "sunsetDate": "",
      "comment": "",
      "doc": "Design System Handbook",
      "docUrl": "https://wiki.meridian.example/design-system",
      "repo": "https://github.com/meridian-labs/design-system",
      "repoName": "design-system",
      "pushedAt": "2026-09-08T08:00:00Z",
      "createdAt": "2023-03-14T09:12:00Z",
      "serviceId": "Design System",
      "serviceRepo": null,
      "language": "TypeScript",
      "framework": "React 19.2.0"
    },
    {
      "name": "shared-models",
      "abbr": "MOD",
      "type": "Library",
      "subtype": "Model",
      "status": "Current",
      "owner": "Platform",
      "cluster": "Shared",
      "applications": [],
      "description": "TypeScript types shared between the clients and the gateway",
      "contact": "Priya Raman",
      "introDate": "",
      "sunsetDate": "",
      "comment": "",
      "doc": "",
      "docUrl": "",
      "repo": "https://github.com/meridian-labs/shared-models",
      "repoName": "shared-models",
      "pushedAt": "2026-08-21T08:00:00Z",
      "createdAt": "2023-06-02T11:00:00Z",
      "serviceId": "shared-models",
      "serviceRepo": null,
      "language": "TypeScript"
    },
    {
      "name": "storefront-web",
      "abbr": "SF",
      "type": "Client",
      "subtype": "",
      "status": "Current",
      "owner": "Storefront",
      "cluster": "",
      "applications": [
        "Shop"
      ],
      "description": "Customer-facing storefront — browse, search and add to cart",
      "contact": "Dana Okafor",
      "introDate": "",
      "sunsetDate": "",
      "comment": "",
      "doc": "Storefront Architecture",
      "docUrl": "https://wiki.meridian.example/storefront",
      "repo": "https://github.com/meridian-labs/storefront-web",
      "repoName": "storefront-web",
      "pushedAt": "2026-09-11T08:00:00Z",
      "createdAt": "2022-11-08T10:00:00Z",
      "serviceId": "storefront-web",
      "serviceRepo": null,
      "language": "TypeScript",
      "framework": "React 19.2.0"
    },
    {
      "name": "checkout-web",
      "abbr": "CO",
      "type": "Client",
      "subtype": "",
      "status": "Current",
      "owner": "Storefront",
      "cluster": "",
      "applications": [
        "Shop"
      ],
      "description": "Checkout and payment flow",
      "contact": "Dana Okafor",
      "introDate": "",
      "sunsetDate": "",
      "comment": "",
      "doc": "",
      "docUrl": "",
      "repo": "https://github.com/meridian-labs/checkout-web",
      "repoName": "checkout-web",
      "pushedAt": "2026-09-05T08:00:00Z",
      "createdAt": "2023-01-19T10:00:00Z",
      "serviceId": "checkout-web",
      "serviceRepo": null,
      "language": "TypeScript",
      "framework": "React 19.2.0"
    },
    {
      "name": "ops-console",
      "abbr": "OPS",
      "type": "Client",
      "subtype": "",
      "status": "Current",
      "owner": "Fulfilment",
      "cluster": "",
      "applications": [
        "Ops Console"
      ],
      "description": "Internal console for order, inventory and shipment operations",
      "contact": "Tomas Lindqvist",
      "introDate": "",
      "sunsetDate": "",
      "comment": "",
      "doc": "Ops Console Runbook",
      "docUrl": "https://wiki.meridian.example/ops-console",
      "repo": "https://github.com/meridian-labs/ops-console",
      "repoName": "ops-console",
      "pushedAt": "2026-09-12T08:00:00Z",
      "createdAt": "2022-08-30T10:00:00Z",
      "serviceId": "ops-console",
      "serviceRepo": null,
      "language": "TypeScript",
      "framework": "React 19.2.0"
    },
    {
      "name": "partner-portal",
      "abbr": "PP",
      "type": "Client",
      "subtype": "",
      "status": "Sunsetting",
      "owner": "Platform",
      "cluster": "",
      "applications": [
        "Partner API"
      ],
      "description": "Self-service portal for integration partners — being replaced by the Partner API",
      "contact": "Sam Whitfield",
      "introDate": "",
      "sunsetDate": "2027-03-31",
      "comment": "Superseded by the Partner API on the edge gateway. Kept live for existing integrations until they migrate.",
      "doc": "",
      "docUrl": "",
      "repo": "https://github.com/meridian-labs/partner-portal",
      "repoName": "partner-portal",
      "pushedAt": "2026-02-14T08:00:00Z",
      "createdAt": "2021-05-11T10:00:00Z",
      "serviceId": "partner-portal",
      "serviceRepo": null,
      "language": "TypeScript",
      "framework": "React 18.2.0"
    },
    {
      "name": "edge-gateway",
      "abbr": "GW",
      "type": "Service",
      "subtype": "Gateway",
      "status": "Current",
      "owner": "Platform",
      "cluster": "",
      "applications": [
        "Partner API",
        "Shop"
      ],
      "description": "Public API edge — routing, auth and rate limiting in front of the services",
      "contact": "Sam Whitfield",
      "introDate": "",
      "sunsetDate": "",
      "comment": "",
      "doc": "",
      "docUrl": "",
      "repo": "https://github.com/meridian-labs/edge-gateway",
      "repoName": "edge-gateway",
      "pushedAt": "2026-08-30T08:00:00Z",
      "createdAt": "2023-09-01T10:00:00Z",
      "serviceId": "edge-gateway",
      "serviceRepo": null,
      "language": "JavaScript"
    },
    {
      "name": "e2e-suite",
      "abbr": "E2E",
      "type": "Tests",
      "subtype": "",
      "status": "Current",
      "owner": "Fulfilment",
      "cluster": "Shared",
      "applications": [],
      "description": "Playwright end-to-end suite covering the shop and ops journeys",
      "contact": "Tomas Lindqvist",
      "introDate": "",
      "sunsetDate": "",
      "comment": "",
      "doc": "",
      "docUrl": "",
      "repo": "https://github.com/meridian-labs/e2e-suite",
      "repoName": "e2e-suite",
      "pushedAt": "2026-09-02T08:00:00Z",
      "createdAt": "2024-02-20T10:00:00Z",
      "serviceId": "e2e-suite",
      "serviceRepo": null,
      "language": "TypeScript"
    },
    {
      "name": "orders-service",
      "abbr": "ORD",
      "type": "Service",
      "subtype": "API",
      "status": "Current",
      "owner": "Fulfilment",
      "cluster": "",
      "applications": [
        "Shop",
        "Ops Console"
      ],
      "description": "Order lifecycle — placement, state machine and payment orchestration",
      "contact": "Yuki Tanaka",
      "introDate": "",
      "sunsetDate": "",
      "comment": "",
      "doc": "Orders Domain Model",
      "docUrl": "https://wiki.meridian.example/orders",
      "repo": "https://github.com/meridian-labs/orders-service",
      "repoName": "orders-service",
      "pushedAt": "2026-09-10T08:00:00Z",
      "createdAt": "2021-09-15T10:00:00Z",
      "serviceId": "orders-service",
      "serviceRepo": null,
      "language": "Java"
    },
    {
      "name": "inventory-service",
      "abbr": "INV",
      "type": "Service",
      "subtype": "API",
      "status": "Current",
      "owner": "Fulfilment",
      "cluster": "",
      "applications": [
        "Ops Console"
      ],
      "description": "Stock levels, reservations and shipment records",
      "contact": "Yuki Tanaka",
      "introDate": "",
      "sunsetDate": "",
      "comment": "",
      "doc": "",
      "docUrl": "",
      "repo": "https://github.com/meridian-labs/inventory-service",
      "repoName": "inventory-service",
      "pushedAt": "2026-09-09T08:00:00Z",
      "createdAt": "2021-10-04T10:00:00Z",
      "serviceId": "inventory-service",
      "serviceRepo": null,
      "language": "Java"
    },
    {
      "name": "notifications-service",
      "abbr": "NOT",
      "type": "Service",
      "subtype": "Worker",
      "status": "Current",
      "owner": "Platform",
      "cluster": "",
      "applications": [],
      "description": "Fans order and inventory events out as email and webhooks",
      "contact": "Sam Whitfield",
      "introDate": "",
      "sunsetDate": "",
      "comment": "",
      "doc": "",
      "docUrl": "",
      "repo": "https://github.com/meridian-labs/notifications-service",
      "repoName": "notifications-service",
      "pushedAt": "2026-07-18T08:00:00Z",
      "createdAt": "2022-04-12T10:00:00Z",
      "serviceId": "notifications-service",
      "serviceRepo": null,
      "language": "Java 21",
      "framework": "Quarkus 3.20.4"
    },
    {
      "name": "catalog-service",
      "abbr": "CAT",
      "type": "Service",
      "subtype": "API",
      "status": "Current",
      "owner": "Storefront",
      "cluster": "",
      "applications": [
        "Shop"
      ],
      "description": "Product catalog, pricing and reviews",
      "contact": "Dana Okafor",
      "introDate": "",
      "sunsetDate": "",
      "comment": "",
      "doc": "",
      "docUrl": "",
      "repo": "https://github.com/meridian-labs/catalog-service",
      "repoName": "catalog-service",
      "pushedAt": "2026-09-03T08:00:00Z",
      "createdAt": "2021-08-02T10:00:00Z",
      "serviceId": "catalog-service",
      "serviceRepo": null,
      "language": "Java"
    },
    {
      "name": "recommendations-service",
      "abbr": "REC",
      "type": "Service",
      "subtype": "API",